<?xml version="1.0" encoding="UTF-8"?>
<!DOCTYPE eps2probandltf_config>

<netcdfloadconfiguration xmlns:xi="http://www.w3.org/2001/XInclude"
	xmlns:xsi="http://www.w3.org/2001/XMLSchema-instance"
	xsi:noNamespaceSchemaLocation="netcdfLoad.configuration.xsd">

	<!--
	<load>
		<netcdf variable_name="altitude" />
		<wdb name="altitude" units="m" validfrom="-infinity" validto="infinity"/>
	</load>
	-->

	<load>
		<netcdf variable_name="lwe_thickness_of_precipitation_amount"/>
		<wdb name="precipitation amount" units="kg/m2" alternativeunitconversion="mm" validfrom="referencetime"/>
	</load>
	<load>
		<netcdf variable_name="precipitation_amount"/>
		<wdb name="precipitation amount" units="kg/m2" alternativeunitconversion="mm" validfrom="referencetime"/>
	</load>
	<load>
		<netcdf variable_name="cloud_area_fraction"/>
		<wdb name="cloud area fraction" units="%"/>
	</load>
	<load>
		<netcdf variable_name="air_temperature"/>
		<wdb name="air temperature" units="K">
			<level name="height above ground" value="2" />
		</wdb>
	</load>
	<load>
		<netcdf variable_name="relative_humidity"/>
		<wdb name="relative humidity" units="%" >
			<level name="height above ground" value="2" />
		</wdb>
	</load>
	<load>
		<netcdf variable_name="wind_speed" />
		<wdb name="wind speed" units="m/s">
			<level name="height above ground" value="10" />
		</wdb>
	</load>
	<load>
		<netcdf variable_name="wind_from_direction"/>
		<wdb name="wind from direction" units="rad" alternativeunitconversion="m/s">
			<level name="height above ground" value="10" />
		</wdb>
	</load>

	<!-- 	
	<load>
		<netcdf variable_name="x_wind_10m"/>
		<wdb name="x wind" units="m/s">
			<level name="height above ground" value="10" />
		</wdb>
	</load>
	<load>
		<netcdf variable_name="y_wind_10m"/>
		<wdb name="y wind" units="m/s">
			<level name="height above ground" value="10" />
		</wdb>
	</load>
	-->

	<load>
		<netcdf variable_name="cloud_area_fraction_in_atmosphere_layer">
			<dimension name="sigma" value="1000" />
		</netcdf>
		<wdb name="cloud area fraction in atmosphere layer" units="%">
			<level name="atmosphere sigma coordinate" value="1000"/>
		</wdb>
	</load>
	<load>
		<netcdf variable_name="cloud_area_fraction_in_atmosphere_layer">
			<dimension name="sigma" value="300" />
		</netcdf>
		<wdb name="cloud area fraction in atmosphere layer" units="%">
			<level name="atmosphere sigma coordinate" value="300"/>
		</wdb>
	</load>
	<load>
		<netcdf variable_name="cloud_area_fraction_in_atmosphere_layer">
			<dimension name="sigma" value="500" />
		</netcdf>
		<wdb name="cloud area fraction in atmosphere layer" units="%">
			<level name="atmosphere sigma coordinate" value="500"/>
		</wdb>
	</load>
	<load>
		<netcdf variable_name="cloud_area_fraction_in_atmosphere_layer">
			<dimension name="sigma" value="850" />
		</netcdf>
		<wdb name="cloud area fraction in atmosphere layer" units="%">
			<level name="atmosphere sigma coordinate" value="850"/>
		</wdb>
	</load>

	<load>
		<netcdf variable_name="sea_level_pressure"/>
		<wdb name="air pressure at sea level" units="Pa"/>
	</load>

	<conversions>
		<vector x="x_wind_10m" y="y_wind_10m">
			<speed name="wind_speed" />
			<direction name="wind_from_direction" />
		</vector>
	</conversions>
	
</netcdfloadconfiguration>
